<?xml version="1.0" encoding="UTF-8" standalone="no"?><exam xmlns="http://www.pagera.i8.com" xmlns:xsi="http://www.w3.org/2001/XMLSchema-instance" xsi:schemaLocation="http://www.pagera.i8.com ExamSchema.xsd"><name>eee</name><time>10</time><questionscount>2</questionscount><average>20</average><question><questionstring>sssss</questionstring><mode>single</mode><answerscount>2</answerscount><note/><answer><state>true</state><answerstring>sss</answerstring></answer><answer><state>false</state><answerstring>wwwwwwwwwww</answerstring></answer></question><question><questionstring>wwwwwwwwwwwww</questionstring><mode>single</mode><answerscount>2</answerscount><note/><answer><state>true</state><answerstring>eeeeeeeeeeeeee</answerstring></answer><answer><state>false</state><answerstring>wwwwwwwww</answerstring></answer></question><writer><wname/><mail/><webaddress/><description/></writer></exam>