<?xml version="1.0" encoding="UTF-8" standalone="no"?><exam xmlns="http://www.pagera.i8.com" xmlns:xsi="http://www.w3.org/2001/XMLSchema-instance" xsi:schemaLocation="http://www.pagera.i8.com ExamSchema.xsd"><name>TestJCP</name><time>120</time><questionscount>3</questionscount><average>72</average><question><questionstring>What is your name?</questionstring><mode>multi</mode><answerscount>3</answerscount><note/><answer><state>true</state><answerstring>Mike	</answerstring></answer><answer><state>true</state><answerstring>Malek</answerstring></answer><answer><state>false</state><answerstring>Boo</answerstring></answer></question><question><questionstring>What is your hair color?</questionstring><mode>single</mode><answerscount>2</answerscount><note/><answer><state>false</state><answerstring>Brown</answerstring></answer><answer><state>true</state><answerstring>Dark</answerstring></answer></question><question><questionstring>Bla Bla</questionstring><mode>single</mode><answerscount>2</answerscount><note/><answer><state>true</state><answerstring>bla1</answerstring></answer><answer><state>false</state><answerstring>bla2</answerstring></answer></question><writer><wname>Mike</wname><mail/><webaddress/><description/></writer></exam>